{
  "command_argv": [
    "runuser",
    "-u",
    "nobody",
    "--",
    "/usr/bin/python3",
    "-m",
    "unittest",
    "discover",
    "-s",
    "distribution/native",
    "-p",
    "test_*.py",
    "-v"
  ],
  "diff_stat_artifact_path": "diff_stat.txt",
  "diff_stat_sha256": "110f44f350de3158ebbe25868f617205ed3aacdde809b9b69187df564258103a",
  "dirty_state_after": [
    "M .github/workflows/playbook-checks.yml",
    " M conftest.py",
    " M docs/tasks.md",
    " M pytest.ini",
    " M requirements-dev.txt",
    " M tests/unit/test_test_first_pilot_assets.py",
    " M tests/unit/test_test_first_pilot_sandbox.py",
    " M tests/unit/test_test_first_pilot_toolchain.py",
    " M tools/test_first_pilot_sandbox.py",
    " M tools/verify_test_first_pilot_toolchain.py",
    "?? docs/evaluation/TEST_FIRST_PILOT_EVIDENCE_AVAILABILITY.md",
    "?? reports/delivery/",
    "?? tests/unit/test_environment_pilot_policy.py",
    "?? tests/unit/test_test_first_pilot_archive.py",
    "?? tools/verify_test_first_pilot_archive.py"
  ],
  "dirty_state_before": [
    "M .github/workflows/playbook-checks.yml",
    " M conftest.py",
    " M docs/tasks.md",
    " M pytest.ini",
    " M requirements-dev.txt",
    " M tests/unit/test_test_first_pilot_assets.py",
    " M tests/unit/test_test_first_pilot_sandbox.py",
    " M tests/unit/test_test_first_pilot_toolchain.py",
    " M tools/test_first_pilot_sandbox.py",
    " M tools/verify_test_first_pilot_toolchain.py",
    "?? docs/evaluation/TEST_FIRST_PILOT_EVIDENCE_AVAILABILITY.md",
    "?? reports/delivery/",
    "?? tests/unit/test_environment_pilot_policy.py",
    "?? tests/unit/test_test_first_pilot_archive.py",
    "?? tools/verify_test_first_pilot_archive.py"
  ],
  "end_timestamp": "2026-10-09T07:57:23Z",
  "environment_summary": {
    "machine": "x86_64",
    "platform": "Linux-5.15.0-170-generic-x86_64-with-glibc2.35",
    "python": "3.12.13",
    "python_executable": "/srv/openclaw-you/workspace/AI_workflow_playbook/.venv-delivery-20261009/bin/python",
    "timed_out": false,
    "timeout": 180.0
  },
  "exit_code": 0,
  "parent_receipt_id": null,
  "producer": "tools/receipt_run.py",
  "receipt_id": "D00-native-unprivileged-1791532638-2ae1e03e",
  "redaction_status": "not_requested",
  "repo_commit_after": "de2478f4a3fdffb4c568898f37a078500f203b8a",
  "repo_commit_before": "de2478f4a3fdffb4c568898f37a078500f203b8a",
  "schema_version": "playbook.command_receipt.v1",
  "start_timestamp": "2026-10-09T07:57:18Z",
  "stderr_artifact_path": "stderr.txt",
  "stderr_sha256": "c5ac8c14d1e5996a2391936b7481aab067617aa93f73087221c0ecdc672e0cd0",
  "stdout_artifact_path": "stdout.txt",
  "stdout_sha256": "e3b0c44298fc1c149afbf4c8996fb92427ae41e4649b934ca495991b7852b855",
  "task_id": "D00-native-unprivileged",
  "working_directory": "/srv/openclaw-you/workspace/AI_workflow_playbook"
}
