{
  "command_argv": [
    ".venv-delivery-20261009/bin/python",
    "-m",
    "pytest",
    "-q",
    "-ra"
  ],
  "diff_stat_artifact_path": "diff_stat.txt",
  "diff_stat_sha256": "e3b0c44298fc1c149afbf4c8996fb92427ae41e4649b934ca495991b7852b855",
  "dirty_state_after": [],
  "dirty_state_before": [],
  "end_timestamp": "2026-10-09T08:08:57Z",
  "environment_summary": {
    "machine": "x86_64",
    "platform": "Linux-5.15.0-170-generic-x86_64-with-glibc2.35",
    "python": "3.12.13",
    "python_executable": "/srv/openclaw-you/workspace/AI_workflow_playbook/.venv-delivery-20261009/bin/python",
    "timed_out": false,
    "timeout": 1800.0
  },
  "exit_code": 0,
  "parent_receipt_id": null,
  "producer": "tools/receipt_run.py",
  "receipt_id": "DELIVERY-full-suite-1791533243-51a5f438",
  "redaction_status": "not_requested",
  "repo_commit_after": "7f36b90859a17c07f47197fed32e5fe1f4c8e1b3",
  "repo_commit_before": "7f36b90859a17c07f47197fed32e5fe1f4c8e1b3",
  "schema_version": "playbook.command_receipt.v1",
  "start_timestamp": "2026-10-09T08:07:23Z",
  "stderr_artifact_path": "stderr.txt",
  "stderr_sha256": "e3b0c44298fc1c149afbf4c8996fb92427ae41e4649b934ca495991b7852b855",
  "stdout_artifact_path": "stdout.txt",
  "stdout_sha256": "1be15eac1c1ff01d77252b2c289c56e6fb68946b5a43b751044d45aa4dc333c9",
  "task_id": "DELIVERY-full-suite",
  "working_directory": "/srv/openclaw-you/workspace/AI_workflow_playbook"
}
