{
  "command_argv": [
    "/usr/sbin/runuser",
    "-u",
    "oc_you",
    "--",
    "/usr/bin/bwrap",
    "--unshare-user",
    "--unshare-pid",
    "--unshare-ipc",
    "--unshare-uts",
    "--die-with-parent",
    "--new-session",
    "--cap-drop",
    "ALL",
    "--ro-bind",
    "/usr",
    "/usr",
    "--ro-bind",
    "/lib",
    "/lib",
    "--ro-bind",
    "/lib64",
    "/lib64",
    "--ro-bind",
    "/bin",
    "/bin",
    "--ro-bind",
    "/etc/ssl",
    "/etc/ssl",
    "--ro-bind",
    "/etc/resolv.conf",
    "/etc/resolv.conf",
    "--proc",
    "/proc",
    "--dev",
    "/dev",
    "--tmpfs",
    "/tmp",
    "--tmpfs",
    "/home",
    "--dir",
    "/home/oc_you",
    "--bind",
    "/tmp/playbook-model-worker-wzb191rs/work/receipt-audit-project",
    "/tmp/playbook-model-worker-wzb191rs/work/receipt-audit-project",
    "--bind",
    "/tmp/playbook-model-worker-wzb191rs/work/ENG-CHANGE-CODEX-codex-state",
    "/home/oc_you/.codex",
    "--ro-bind",
    "/tmp/playbook-model-worker-wzb191rs/python",
    "/tmp/playbook-model-worker-wzb191rs/python",
    "--ro-bind",
    "/tmp/playbook-model-worker-wzb191rs/work/venv",
    "/tmp/playbook-model-worker-wzb191rs/work/venv",
    "--chdir",
    "/tmp/playbook-model-worker-wzb191rs/work/receipt-audit-project",
    "--",
    "/usr/bin/codex",
    "-c",
    "model_provider=\"delivery_relay\"",
    "-c",
    "model_providers.delivery_relay.name=\"Delivery original account relay\"",
    "-c",
    "model_providers.delivery_relay.base_url=\"http://127.0.0.1:44067/v1\"",
    "-c",
    "model_providers.delivery_relay.env_key=\"DELIVERY_LOCAL_TOKEN\"",
    "-c",
    "model_providers.delivery_relay.wire_api=\"responses\"",
    "-c",
    "model_providers.delivery_relay.requires_openai_auth=false",
    "-c",
    "model_providers.delivery_relay.supports_websockets=false",
    "-c",
    "model_providers.delivery_relay.request_max_retries=0",
    "-c",
    "model_providers.delivery_relay.stream_max_retries=0",
    "-c",
    "model_reasoning_effort=\"high\"",
    "-c",
    "approval_policy=\"never\"",
    "exec",
    "--ephemeral",
    "--sandbox",
    "workspace-write",
    "--model",
    "gpt-6.1-sol",
    "--json",
    "-C",
    "/tmp/playbook-model-worker-wzb191rs/work/receipt-audit-project",
    "-o",
    "/tmp/playbook-model-worker-wzb191rs/work/receipt-audit-project/.codex-last-message.txt",
    "Read CHANGE_TASK.md and current CODEX_PROMPT/state. This is continuation, notbootstrap. Implement the specificopt-in strict-exit flag; preserve existingdata/owner localchanges/pinnedcontract/default behavior, runoldandnewtests, updatecurrenthandoffwithactualresults. Independentreviewwillactuallybeexecutedbycontroller afterward; do notinventapprovalorlaunchnestedreview. Workonlyinthisproject.\n"
  ],
  "diff_stat_artifact_path": "diff_stat.txt",
  "diff_stat_sha256": "e3b0c44298fc1c149afbf4c8996fb92427ae41e4649b934ca495991b7852b855",
  "dirty_state_after": [
    "not_inspected"
  ],
  "dirty_state_before": [
    "not_inspected"
  ],
  "end_timestamp": "2026-10-09T11:24:36Z",
  "environment_summary": {
    "end_monotonic_ns": 17902062931688870,
    "git_inspection": false,
    "platform": "Linux-5.15.0-170-generic-x86_64-with-glibc2.35",
    "python": "3.10.12",
    "start_monotonic_ns": 17902020300792725,
    "timed_out": false,
    "timeout": 420
  },
  "exit_code": 1,
  "parent_receipt_id": null,
  "producer": "ai_workflow_harness_lab.receipts",
  "receipt_id": "ENG-CHANGE-CODEX-1791545076-5e5310ca",
  "redaction_status": "not_requested",
  "repo_commit_after": "not_inspected",
  "repo_commit_before": "not_inspected",
  "schema_version": "playbook.command_receipt.v1",
  "start_timestamp": "2026-10-09T11:23:53Z",
  "stderr_artifact_path": "stderr.txt",
  "stderr_sha256": "1aa26269eb1cc57f86b235a03cda53c004edb5b1e9fc99d4da4f00843293d721",
  "stdout_artifact_path": "stdout.txt",
  "stdout_sha256": "cfaaabd7a3025fb58936fd198d45f8743c765919ced2ee47aa46afc243f4c9f5",
  "task_id": "ENG-CHANGE-CODEX",
  "working_directory": "/tmp/playbook-model-worker-wzb191rs/work/receipt-audit-project"
}
