{
  "command_argv": [
    "bash",
    "-lc",
    ".venv/bin/python -m pytest tests/unit/test_receipt_and_evidence.py -q"
  ],
  "diff_stat_artifact_path": "diff_stat.txt",
  "diff_stat_sha256": "3750fe4ad60f7570a0b4a4544e2374bf853a20146280fcf4b4e2e922c55fb731",
  "dirty_state_after": [
    "M PLAYBOOK.md",
    " M README.md",
    " M companion/ai_workflow_harness_lab/README.md",
    " M docs/PROJECT_PLAN.md",
    " M docs/agent_harness/HARNESS_EVALUATION_PROTOCOL.md",
    " M docs/evaluation/CI_EVAL_GATE.md",
    " M docs/evaluation/PLAYBOOK_EMPIRICAL_VALIDATION.md",
    " M docs/tasks.md",
    " M docs/usage_guide.md",
    " M prompts/ORCHESTRATOR.md",
    " M prompts/PHASE1_VALIDATOR.md",
    " M prompts/audit/AUDIT_INDEX.md",
    " M prompts/audit/PROMPT_2_CODE.md",
    " M prompts/audit/PROMPT_3_CONSOLIDATED.md",
    " M schemas/task.schema.json",
    " M templates/CODEX_PROMPT.md",
    " M templates/EVIDENCE_INDEX.md",
    " M templates/IMPLEMENTATION_CONTRACT.md",
    " M templates/RETRIEVAL_EVAL_PLAN.md",
    " M templates/ROUTER_EVAL.md",
    " M templates/RUNTIME_VERIFICATION_RECORD.md",
    " M templates/TASKS.md",
    " M tests/unit/test_playbook_validate.py",
    " M tests/unit/test_receipt_and_evidence.py",
    " M tools/playbook_validate.py",
    " M tools/validate_harness_evidence.py",
    "?? .codex",
    "?? deep-research-report(1).md",
    "?? docs/TEST_FIRST_AGENTIC_ROADMAP.md",
    "?? docs/audit/",
    "?? docs/evaluation/CRITIC_CALIBRATION.md",
    "?? docs/evaluation/TEST_FIRST_PILOT_PLAN.md",
    "?? docs/evaluation/TEST_FIRST_PILOT_RESULTS.md",
    "?? docs/merge_authority.md",
    "?? docs/testing/",
    "?? prompts/IMPLEMENTER_TDD.md",
    "?? prompts/audit/PROMPT_TEST_CRITIC.md",
    "?? reports/test_first_pilot/",
    "?? reports/test_first_roadmap/",
    "?? templates/TEST_CRITIC_REPORT.md"
  ],
  "dirty_state_before": [
    "M PLAYBOOK.md",
    " M README.md",
    " M companion/ai_workflow_harness_lab/README.md",
    " M docs/PROJECT_PLAN.md",
    " M docs/agent_harness/HARNESS_EVALUATION_PROTOCOL.md",
    " M docs/evaluation/CI_EVAL_GATE.md",
    " M docs/evaluation/PLAYBOOK_EMPIRICAL_VALIDATION.md",
    " M docs/tasks.md",
    " M docs/usage_guide.md",
    " M prompts/ORCHESTRATOR.md",
    " M prompts/PHASE1_VALIDATOR.md",
    " M prompts/audit/AUDIT_INDEX.md",
    " M prompts/audit/PROMPT_2_CODE.md",
    " M prompts/audit/PROMPT_3_CONSOLIDATED.md",
    " M schemas/task.schema.json",
    " M templates/CODEX_PROMPT.md",
    " M templates/EVIDENCE_INDEX.md",
    " M templates/IMPLEMENTATION_CONTRACT.md",
    " M templates/RETRIEVAL_EVAL_PLAN.md",
    " M templates/ROUTER_EVAL.md",
    " M templates/RUNTIME_VERIFICATION_RECORD.md",
    " M templates/TASKS.md",
    " M tests/unit/test_playbook_validate.py",
    " M tests/unit/test_receipt_and_evidence.py",
    " M tools/playbook_validate.py",
    " M tools/validate_harness_evidence.py",
    "?? .codex",
    "?? deep-research-report(1).md",
    "?? docs/TEST_FIRST_AGENTIC_ROADMAP.md",
    "?? docs/audit/",
    "?? docs/evaluation/CRITIC_CALIBRATION.md",
    "?? docs/evaluation/TEST_FIRST_PILOT_PLAN.md",
    "?? docs/evaluation/TEST_FIRST_PILOT_RESULTS.md",
    "?? docs/merge_authority.md",
    "?? docs/testing/",
    "?? prompts/IMPLEMENTER_TDD.md",
    "?? prompts/audit/PROMPT_TEST_CRITIC.md",
    "?? reports/test_first_pilot/",
    "?? reports/test_first_roadmap/",
    "?? templates/TEST_CRITIC_REPORT.md"
  ],
  "end_timestamp": "2026-07-13T20:08:14Z",
  "environment_summary": {
    "machine": "x86_64",
    "platform": "Linux-6.17.0-35-generic-x86_64-with-glibc2.39",
    "python": "3.12.3",
    "python_executable": "/home/ashishki/Documents/dev/ai-stack/projects/AI_workflow_playbook/.venv/bin/python",
    "timed_out": false,
    "timeout": null
  },
  "exit_code": 0,
  "parent_receipt_id": null,
  "producer": "tools/receipt_run.py",
  "receipt_id": "TFA-ROADMAP-1783973288-600703d6",
  "redaction_status": "not_requested",
  "repo_commit_after": "aea241a07a283150812a97c551bd165af93023ed",
  "repo_commit_before": "aea241a07a283150812a97c551bd165af93023ed",
  "schema_version": "playbook.command_receipt.v1",
  "start_timestamp": "2026-07-13T20:08:08Z",
  "stderr_artifact_path": "stderr.txt",
  "stderr_sha256": "e3b0c44298fc1c149afbf4c8996fb92427ae41e4649b934ca495991b7852b855",
  "stdout_artifact_path": "stdout.txt",
  "stdout_sha256": "cc2da9433bfb94ffed646c022542770ea8b4ce5f0628b9913010ef3dcf6f8a4f",
  "task_id": "TFA-ROADMAP",
  "working_directory": "/home/ashishki/Documents/dev/ai-stack/projects/AI_workflow_playbook"
}
