{
  "command_argv": [
    "tools/run_test_first_pilot.sh",
    "--preflight-only"
  ],
  "diff_stat_artifact_path": "diff_stat.txt",
  "diff_stat_sha256": "4de26b5d34135e4ecdcf1d27ebcfe703f5b830cbd07aac338e73f79155e6060a",
  "dirty_state_after": [
    "M PLAYBOOK.md",
    " M README.md",
    " M companion/ai_workflow_harness_lab/README.md",
    " M companion/ai_workflow_harness_lab/src/ai_workflow_harness_lab/adapters/command.py",
    " M companion/ai_workflow_harness_lab/src/ai_workflow_harness_lab/cli.py",
    " M companion/ai_workflow_harness_lab/src/ai_workflow_harness_lab/runner.py",
    " M companion/ai_workflow_harness_lab/src/ai_workflow_harness_lab/scorers/shell.py",
    " M companion/ai_workflow_harness_lab/tests/test_cli.py",
    " M docs/PROJECT_PLAN.md",
    " M docs/agent_harness/HARNESS_EVALUATION_PROTOCOL.md",
    " M docs/evaluation/CI_EVAL_GATE.md",
    " M docs/evaluation/PLAYBOOK_EMPIRICAL_VALIDATION.md",
    " M docs/tasks.md",
    " M docs/usage_guide.md",
    " M prompts/ORCHESTRATOR.md",
    " M prompts/PHASE1_VALIDATOR.md",
    " M prompts/audit/AUDIT_INDEX.md",
    " M prompts/audit/PROMPT_2_CODE.md",
    " M prompts/audit/PROMPT_3_CONSOLIDATED.md",
    " M schemas/task.schema.json",
    " M templates/CODEX_PROMPT.md",
    " M templates/EVIDENCE_INDEX.md",
    " M templates/IMPLEMENTATION_CONTRACT.md",
    " M templates/RETRIEVAL_EVAL_PLAN.md",
    " M templates/ROUTER_EVAL.md",
    " M templates/RUNTIME_VERIFICATION_RECORD.md",
    " M templates/TASKS.md",
    " M tests/unit/test_playbook_validate.py",
    " M tests/unit/test_receipt_and_evidence.py",
    " M tools/playbook_validate.py",
    " M tools/validate_harness_evidence.py",
    "?? .codex",
    "?? companion/ai_workflow_harness_lab/suites/shishki_bot_ci_v1/",
    "?? companion/ai_workflow_harness_lab/tests/test_shell_scorer.py",
    "?? deep-research-report(1).md",
    "?? docs/TEST_FIRST_AGENTIC_ROADMAP.md",
    "?? docs/audit/",
    "?? docs/evaluation/CRITIC_CALIBRATION.md",
    "?? docs/evaluation/TEST_FIRST_PILOT_PLAN.md",
    "?? docs/evaluation/TEST_FIRST_PILOT_RESULTS.md",
    "?? docs/merge_authority.md",
    "?? docs/testing/",
    "?? prompts/IMPLEMENTER_TDD.md",
    "?? prompts/audit/PROMPT_TEST_CRITIC.md",
    "?? reports/test_first_pilot/",
    "?? reports/test_first_roadmap/",
    "?? schemas/test_first_pilot_event.schema.json",
    "?? templates/TEST_CRITIC_REPORT.md",
    "?? tests/unit/test_test_first_pilot_adapter.py",
    "?? tests/unit/test_test_first_pilot_assets.py",
    "?? tools/run_test_first_pilot.sh",
    "?? tools/test_first_pilot_codex_adapter.py"
  ],
  "dirty_state_before": [
    "M PLAYBOOK.md",
    " M README.md",
    " M companion/ai_workflow_harness_lab/README.md",
    " M companion/ai_workflow_harness_lab/src/ai_workflow_harness_lab/adapters/command.py",
    " M companion/ai_workflow_harness_lab/src/ai_workflow_harness_lab/cli.py",
    " M companion/ai_workflow_harness_lab/src/ai_workflow_harness_lab/runner.py",
    " M companion/ai_workflow_harness_lab/src/ai_workflow_harness_lab/scorers/shell.py",
    " M companion/ai_workflow_harness_lab/tests/test_cli.py",
    " M docs/PROJECT_PLAN.md",
    " M docs/agent_harness/HARNESS_EVALUATION_PROTOCOL.md",
    " M docs/evaluation/CI_EVAL_GATE.md",
    " M docs/evaluation/PLAYBOOK_EMPIRICAL_VALIDATION.md",
    " M docs/tasks.md",
    " M docs/usage_guide.md",
    " M prompts/ORCHESTRATOR.md",
    " M prompts/PHASE1_VALIDATOR.md",
    " M prompts/audit/AUDIT_INDEX.md",
    " M prompts/audit/PROMPT_2_CODE.md",
    " M prompts/audit/PROMPT_3_CONSOLIDATED.md",
    " M schemas/task.schema.json",
    " M templates/CODEX_PROMPT.md",
    " M templates/EVIDENCE_INDEX.md",
    " M templates/IMPLEMENTATION_CONTRACT.md",
    " M templates/RETRIEVAL_EVAL_PLAN.md",
    " M templates/ROUTER_EVAL.md",
    " M templates/RUNTIME_VERIFICATION_RECORD.md",
    " M templates/TASKS.md",
    " M tests/unit/test_playbook_validate.py",
    " M tests/unit/test_receipt_and_evidence.py",
    " M tools/playbook_validate.py",
    " M tools/validate_harness_evidence.py",
    "?? .codex",
    "?? companion/ai_workflow_harness_lab/suites/shishki_bot_ci_v1/",
    "?? companion/ai_workflow_harness_lab/tests/test_shell_scorer.py",
    "?? deep-research-report(1).md",
    "?? docs/TEST_FIRST_AGENTIC_ROADMAP.md",
    "?? docs/audit/",
    "?? docs/evaluation/CRITIC_CALIBRATION.md",
    "?? docs/evaluation/TEST_FIRST_PILOT_PLAN.md",
    "?? docs/evaluation/TEST_FIRST_PILOT_RESULTS.md",
    "?? docs/merge_authority.md",
    "?? docs/testing/",
    "?? prompts/IMPLEMENTER_TDD.md",
    "?? prompts/audit/PROMPT_TEST_CRITIC.md",
    "?? reports/test_first_pilot/",
    "?? reports/test_first_roadmap/",
    "?? schemas/test_first_pilot_event.schema.json",
    "?? templates/TEST_CRITIC_REPORT.md",
    "?? tests/unit/test_test_first_pilot_adapter.py",
    "?? tests/unit/test_test_first_pilot_assets.py",
    "?? tools/run_test_first_pilot.sh",
    "?? tools/test_first_pilot_codex_adapter.py"
  ],
  "end_timestamp": "2026-07-14T06:39:25Z",
  "environment_summary": {
    "machine": "x86_64",
    "platform": "Linux-6.17.0-35-generic-x86_64-with-glibc2.39",
    "python": "3.12.3",
    "python_executable": "/home/ashishki/Documents/dev/ai-stack/projects/AI_workflow_playbook/.venv/bin/python",
    "timed_out": false,
    "timeout": 120.0
  },
  "exit_code": 0,
  "parent_receipt_id": null,
  "producer": "tools/receipt_run.py",
  "receipt_id": "TFA-7.1-1784011163-91240454",
  "redaction_status": "not_requested",
  "repo_commit_after": "aea241a07a283150812a97c551bd165af93023ed",
  "repo_commit_before": "aea241a07a283150812a97c551bd165af93023ed",
  "schema_version": "playbook.command_receipt.v1",
  "start_timestamp": "2026-07-14T06:39:23Z",
  "stderr_artifact_path": "stderr.txt",
  "stderr_sha256": "e3b0c44298fc1c149afbf4c8996fb92427ae41e4649b934ca495991b7852b855",
  "stdout_artifact_path": "stdout.txt",
  "stdout_sha256": "b1f4ca734a0800874b2d2f09aaff03dae182f7bc7894d81da755b8836f355daa",
  "task_id": "TFA-7.1",
  "working_directory": "/home/ashishki/Documents/dev/ai-stack/projects/AI_workflow_playbook"
}
