{
  "command_argv": [
    ".venv/bin/harness-lab",
    "run",
    "--suite",
    "companion/ai_workflow_harness_lab/suites/playbook_core_v1",
    "--condition",
    "baseline",
    "--adapter",
    "scripted",
    "--trials",
    "1",
    "--output",
    "reports/playbook_eval/baseline"
  ],
  "diff_stat_artifact_path": "diff_stat.txt",
  "diff_stat_sha256": "132ecd03b347aa0a5788f8fd06adc635717be3efec9fa094e7fe4a1dbb0a6d53",
  "dirty_state_after": [
    "M .github/workflows/playbook-checks.yml",
    " M README.md",
    " M ci/ci.yml",
    " M docs/adoption_modes.md",
    " M docs/agent_harness/AGENT_HARNESS_DESIGN.md",
    " M docs/agent_harness/HARNESS_EVAL_PLAN.md",
    " M docs/architecture_layers.md",
    " M docs/tasks.md",
    " M templates/HARNESS_BENCHMARK_CARD.md",
    " M templates/RUNTIME_VERIFICATION_RECORD.md",
    " M tools/README.md",
    " M tools/init_playbook_project.py",
    "?? .codex",
    "?? .gitignore",
    "?? companion/",
    "?? docs/agent_harness/HARNESS_EVALUATION_PROTOCOL.md",
    "?? docs/evaluation/PLAYBOOK_EMPIRICAL_VALIDATION.md",
    "?? reports/evidence_fixture_validation.json",
    "?? reports/playbook_eval/",
    "?? reports/playbook_validation.json",
    "?? reports/playbook_validation_modes.json",
    "?? reports/playbook_validation_tasks.json",
    "?? reports/playbook_verification.json",
    "?? reports/receipts/",
    "?? reports/verification/",
    "?? schemas/command_receipt.schema.json",
    "?? schemas/evidence_bundle.schema.json",
    "?? schemas/failure_record.schema.json",
    "?? schemas/harness_eval_unit.schema.json",
    "?? schemas/run_result.schema.json",
    "?? schemas/task.schema.json",
    "?? tests/",
    "?? tools/playbook_validate.py",
    "?? tools/receipt_run.py",
    "?? tools/validate_harness_evidence.py",
    "?? tools/verify_playbook.py"
  ],
  "dirty_state_before": [
    "M .github/workflows/playbook-checks.yml",
    " M README.md",
    " M ci/ci.yml",
    " M docs/adoption_modes.md",
    " M docs/agent_harness/AGENT_HARNESS_DESIGN.md",
    " M docs/agent_harness/HARNESS_EVAL_PLAN.md",
    " M docs/architecture_layers.md",
    " M docs/tasks.md",
    " M templates/HARNESS_BENCHMARK_CARD.md",
    " M templates/RUNTIME_VERIFICATION_RECORD.md",
    " M tools/README.md",
    " M tools/init_playbook_project.py",
    "?? .codex",
    "?? .gitignore",
    "?? companion/",
    "?? docs/agent_harness/HARNESS_EVALUATION_PROTOCOL.md",
    "?? docs/evaluation/PLAYBOOK_EMPIRICAL_VALIDATION.md",
    "?? reports/evidence_fixture_validation.json",
    "?? reports/playbook_eval/",
    "?? reports/playbook_validation.json",
    "?? reports/playbook_validation_modes.json",
    "?? reports/playbook_validation_tasks.json",
    "?? reports/playbook_verification.json",
    "?? reports/receipts/",
    "?? reports/verification/",
    "?? schemas/command_receipt.schema.json",
    "?? schemas/evidence_bundle.schema.json",
    "?? schemas/failure_record.schema.json",
    "?? schemas/harness_eval_unit.schema.json",
    "?? schemas/run_result.schema.json",
    "?? schemas/task.schema.json",
    "?? tests/",
    "?? tools/playbook_validate.py",
    "?? tools/receipt_run.py",
    "?? tools/validate_harness_evidence.py",
    "?? tools/verify_playbook.py"
  ],
  "end_timestamp": "2026-07-10T10:38:50Z",
  "environment_summary": {
    "machine": "x86_64",
    "platform": "Linux-6.17.0-35-generic-x86_64-with-glibc2.39",
    "python": "3.12.3",
    "python_executable": "/home/ashishki/Documents/dev/ai-stack/projects/AI_workflow_playbook/.venv/bin/python",
    "timed_out": false,
    "timeout": null
  },
  "exit_code": 0,
  "parent_receipt_id": null,
  "producer": "tools/receipt_run.py",
  "receipt_id": "final-companion-baseline-1783679929-63b5a311",
  "redaction_status": "not_requested",
  "repo_commit_after": "362c2a548b806f0b5d705601e948752990b39643",
  "repo_commit_before": "362c2a548b806f0b5d705601e948752990b39643",
  "schema_version": "playbook.command_receipt.v1",
  "start_timestamp": "2026-07-10T10:38:49Z",
  "stderr_artifact_path": "stderr.txt",
  "stderr_sha256": "e3b0c44298fc1c149afbf4c8996fb92427ae41e4649b934ca495991b7852b855",
  "stdout_artifact_path": "stdout.txt",
  "stdout_sha256": "9854634a1611ba0bd1b5044a20b4510e1148df0a840c493b62142ee8d1256e9a",
  "task_id": "final-companion-baseline",
  "working_directory": "/home/ashishki/Documents/dev/ai-stack/projects/AI_workflow_playbook"
}
