{
  "command_argv": [
    "python3",
    "-B",
    "-m",
    "unittest",
    "discover",
    "-s",
    "tests/vnext",
    "-v"
  ],
  "diff_stat_artifact_path": "diff_stat.txt",
  "diff_stat_sha256": "9e0169f8d23ebd6252d30b8d24e4e5a9c27c9197b70e7b0c366973ba62360399",
  "dirty_state_after": [
    "M engineering/experiments/controlled-delegation/ROUND3_PROTOCOL_RU.md",
    " M engineering/experiments/controlled-delegation/round3.py",
    " M tests/vnext/test_controlled_delegation_round3.py"
  ],
  "dirty_state_before": [
    "M engineering/experiments/controlled-delegation/ROUND3_PROTOCOL_RU.md",
    " M engineering/experiments/controlled-delegation/round3.py",
    " M tests/vnext/test_controlled_delegation_round3.py"
  ],
  "end_timestamp": "2026-10-08T19:12:50Z",
  "environment_summary": {
    "machine": "x86_64",
    "platform": "Linux-5.15.0-170-generic-x86_64-with-glibc2.35",
    "python": "3.10.12",
    "python_executable": "/usr/bin/python3",
    "timed_out": false,
    "timeout": 300.0
  },
  "exit_code": 0,
  "parent_receipt_id": null,
  "producer": "tools/receipt_run.py",
  "receipt_id": "round3-postfix-vnext-1791486759-6b69b6e4",
  "redaction_status": "not_requested",
  "repo_commit_after": "0c27438fed97e2de9e98c1d84552e933a97d65ee",
  "repo_commit_before": "0c27438fed97e2de9e98c1d84552e933a97d65ee",
  "schema_version": "playbook.command_receipt.v1",
  "start_timestamp": "2026-10-08T19:12:39Z",
  "stderr_artifact_path": "stderr.txt",
  "stderr_sha256": "a9422c4da8f84c1f2881e643297ab6bcda61695a794e1042d4b87e3258bf5647",
  "stdout_artifact_path": "stdout.txt",
  "stdout_sha256": "e3b0c44298fc1c149afbf4c8996fb92427ae41e4649b934ca495991b7852b855",
  "task_id": "round3-postfix-vnext",
  "working_directory": "/srv/openclaw-you/workspace/AI_workflow_playbook"
}
