{
  "command_argv": [
    "python3",
    "-c",
    "print('ok')"
  ],
  "diff_stat_artifact_path": "diff_stat.txt",
  "diff_stat_sha256": "3888225779e03d34a944a984fb84ca0947420a8b700a201315cc8cecee9732b8",
  "dirty_state_after": [
    "M README.md",
    " M docs/tasks.md",
    " M tools/init_playbook_project.py",
    "?? .codex",
    "?? .gitignore",
    "?? reports/playbook_validation.json",
    "?? reports/playbook_validation_modes.json",
    "?? reports/playbook_validation_tasks.json",
    "?? schemas/command_receipt.schema.json",
    "?? schemas/evidence_bundle.schema.json",
    "?? schemas/failure_record.schema.json",
    "?? schemas/harness_eval_unit.schema.json",
    "?? schemas/run_result.schema.json",
    "?? schemas/task.schema.json",
    "?? tests/",
    "?? tools/playbook_validate.py",
    "?? tools/receipt_run.py",
    "?? tools/validate_harness_evidence.py"
  ],
  "dirty_state_before": [
    "M README.md",
    " M docs/tasks.md",
    " M tools/init_playbook_project.py",
    "?? .codex",
    "?? .gitignore",
    "?? reports/playbook_validation.json",
    "?? reports/playbook_validation_modes.json",
    "?? reports/playbook_validation_tasks.json",
    "?? schemas/command_receipt.schema.json",
    "?? schemas/evidence_bundle.schema.json",
    "?? schemas/failure_record.schema.json",
    "?? schemas/harness_eval_unit.schema.json",
    "?? schemas/run_result.schema.json",
    "?? schemas/task.schema.json",
    "?? tests/",
    "?? tools/playbook_validate.py",
    "?? tools/receipt_run.py",
    "?? tools/validate_harness_evidence.py"
  ],
  "end_timestamp": "2026-07-10T10:20:23Z",
  "environment_summary": {
    "machine": "x86_64",
    "platform": "Linux-6.17.0-35-generic-x86_64-with-glibc2.39",
    "python": "3.12.3",
    "python_executable": "/usr/bin/python3",
    "timed_out": false,
    "timeout": null
  },
  "exit_code": 0,
  "parent_receipt_id": null,
  "producer": "tools/receipt_run.py",
  "receipt_id": "smoke-1783678823-8ef5c608",
  "redaction_status": "not_requested",
  "repo_commit_after": "362c2a548b806f0b5d705601e948752990b39643",
  "repo_commit_before": "362c2a548b806f0b5d705601e948752990b39643",
  "schema_version": "playbook.command_receipt.v1",
  "start_timestamp": "2026-07-10T10:20:23Z",
  "stderr_artifact_path": "stderr.txt",
  "stderr_sha256": "e3b0c44298fc1c149afbf4c8996fb92427ae41e4649b934ca495991b7852b855",
  "stdout_artifact_path": "stdout.txt",
  "stdout_sha256": "dc51b8c96c2d745df3bd5590d990230a482fd247123599548e0632fdbf97fc22",
  "task_id": "smoke",
  "working_directory": "/home/ashishki/Documents/dev/ai-stack/projects/AI_workflow_playbook"
}
