{
  "command_argv": [
    ".venv-delivery-20261009/bin/python",
    "distribution/desktop/build.py",
    "--output",
    ".playbook-artifacts/delivery-acceptance-20261009/desktop-final/accepted-bundle"
  ],
  "diff_stat_artifact_path": "diff_stat.txt",
  "diff_stat_sha256": "e3b0c44298fc1c149afbf4c8996fb92427ae41e4649b934ca495991b7852b855",
  "dirty_state_after": [],
  "dirty_state_before": [],
  "end_timestamp": "2026-10-09T08:08:33Z",
  "environment_summary": {
    "machine": "x86_64",
    "platform": "Linux-5.15.0-170-generic-x86_64-with-glibc2.35",
    "python": "3.12.13",
    "python_executable": "/srv/openclaw-you/workspace/AI_workflow_playbook/.venv-delivery-20261009/bin/python",
    "timed_out": false,
    "timeout": 900.0
  },
  "exit_code": 0,
  "parent_receipt_id": null,
  "producer": "tools/receipt_run.py",
  "receipt_id": "integrated-desktop-final-preview4-build-1791533272-dba367ee",
  "redaction_status": "not_requested",
  "repo_commit_after": "7f36b90859a17c07f47197fed32e5fe1f4c8e1b3",
  "repo_commit_before": "7f36b90859a17c07f47197fed32e5fe1f4c8e1b3",
  "schema_version": "playbook.command_receipt.v1",
  "start_timestamp": "2026-10-09T08:07:52Z",
  "stderr_artifact_path": "stderr.txt",
  "stderr_sha256": "c99a6eb3b1f27b7850d6536adf89af0eff1b08196bf04df97a17e93a667f13ec",
  "stdout_artifact_path": "stdout.txt",
  "stdout_sha256": "8563875428b338881cd5ecd1e4a79745b15d0f7e70fc0d52b8ce07e85ff535de",
  "task_id": "integrated-desktop-final-preview4-build",
  "working_directory": "/srv/openclaw-you/workspace/AI_workflow_playbook"
}
